{
  "schemaVersion": "azzle-xmtp-v1",
  "type": "DeliveryNotice",
  "negotiationId": "550e8400-e29b-41d4-a716-446655440001",
  "taskId": "42",
  "sequence": 2,
  "previousHash": "0xcccccccccccccccccccccccccccccccccccccccccccccccccccccccccccccccc",
  "timestamp": "2026-06-13T12:05:00.000Z",
  "sender": {
    "evmAddress": "0x0000000000000000000000000000000000000002",
    "xmtpPublicKey": "worker-pubkey"
  },
  "payload": {
    "type": "azzle/DeliveryNotice",
    "taskId": "42",
    "milestoneIndex": 0,
    "receiptHash": "0xdddddddddddddddddddddddddddddddddddddddddddddddddddddddddddddddd"
  }
}
